{
  "$schema": "https://json-schema.org/draft/2020-12/schema",
  "$id": "https://op-cli.local/schemas/baseline.v1.json",
  "title": "caliper baseline response",
  "type": "object",
  "required": [
    "schema_version",
    "command",
    "request_id",
    "timestamp_utc",
    "status",
    "error",
    "warnings",
    "meta",
    "baseline"
  ],
  "properties": {
    "schema_version": {
      "type": "string",
      "const": "1.1"
    },
    "command": {
      "type": "string",
      "const": "baseline"
    },
    "request_id": {
      "type": "string"
    },
    "timestamp_utc": {
      "type": "string",
      "format": "date-time"
    },
    "status": {
      "type": "string",
      "enum": [
        "success",
        "error"
      ]
    },
    "error": {
      "type": [
        "object",
        "null"
      ]
    },
    "warnings": {
      "type": "array",
      "items": {
        "type": "string"
      }
    },
    "meta": {
      "type": "object",
      "required": [
        "command",
        "request_id",
        "timestamp_utc",
        "image_path",
        "image_width",
        "image_height",
        "processing_time_ms",
        "omniparser_version",
        "cli_version"
      ],
      "additionalProperties": true
    },
    "baseline": {
      "type": "object",
      "required": [
        "config_path",
        "project_name",
        "reference_image",
        "viewport",
        "region_count",
        "assertion_count",
        "config"
      ],
      "additionalProperties": true
    }
  },
  "additionalProperties": true
}
